{
  "schemaVersion": 1,
  "workName": "【失禁注意!】…『脳イキ』ノーハンドオナニー",
  "scores": { "trance": 7.0, "pleasure": 8.0, "satisfaction": 7.0 },
  "orgasmSummary": "ドライ 3回前後（脳イキ手順・PC筋反復の山）、ウェット 1回前後（具現化パート想定。出方の差は本文併記）",
  "notes": [
    "【採点方針】三軸定義に従い、好み差を点数主因に据えない。",
    "【基準作比較】unknown-hypno-… 型。本作=実習手順+ノーハンド（Aより作業比重、別レーン）。",
    "トランス 7…手順明瞭型で誘導深さより作業導線。",
    "快楽 8…C-0=脳イキ+PC+具現化。C-1=技法の明瞭さと帯上の畳み。",
    "満足 7…本編比し解除帯は短い帯配分。戻し手続きは一トラックで揃う。",
    "本編55分。失禁注意の販売表示に従う。",
    "【参照】info のトラック表。analysis/ 同梱。"
  ]
}
