{
  "schemaVersion": 1,
  "workName": "耳かき催眠",
  "scores": {
    "trance": 8,
    "pleasure": 9,
    "satisfaction": 8
  },
  "orgasmSummary": "ドライ3回（耳かき幸福感・催眠持続・快感波）／ウェット1回（終盤の口淫回収）",
  "notes": [
    "評価は docs/レビュー三軸評価定義.md に準拠（鑑賞用・臨床非保証）。",
    "尺は解析データの通し集約で約80分11秒。注意事項→誘導→耳かき→エロ→覚醒の5段構成。",
    "主軸は『サロン規約の先行提示』『顔・耳周りを使った段階的リラックス』『耳かきで幸福感を固定』『終盤の性的サービスと覚醒手順』の四層。",
    "比較アンカー: 下限は耳責め単発ASMR、上限は催眠導入と覚醒まで一式揃った耳かき催眠として把握。",
    "【自動補助根拠】derived_metrics.json: duration=4741.489s / rms_mean=0.0042221 / silence_ratio=0.6457 / surge_events_per_min=30.067。",
    "【自動補助根拠】keyword_counts: 可愛い=2, ワン=0, 行け=1, 泣=0。event_counts: countdown=2, trigger=25, release=3。",
    "【自動補助根拠】sections.auto.json: 導入0.0-300.0 / 深化300.0-650.0 / 快楽650.0-4581.489 / 解除4581.489-4741.489。"
  ]
}
