{
  "schemaVersion": 1,
  "workName": "ふたりがけ催眠カミングオーガズム編 v2",
  "scores": { "trance": 8.0, "pleasure": 8.0, "satisfaction": 8.0 },
  "orgasmSummary": "ドライオーガズム 3回前後（来る系・囁き積み）。ウェットは作風上前面でない想定",
  "notes": [
    "【再評価 2026-04】docs/レビュー三軸評価定義.md 現行。三軸揃い・総合★8 整合。トランス=誘導の厚み（ふたり定位）、満足=008解除手続の一貫。",
    "【採点方針】三軸定義に従い、好み差を点数主因に据えない。",
    "【基準作比較】unknown-hypno-… 型。本作＝ふたりがけ×「来る」積み＋左右定位（別レーン）。",
    "トランス 8…囁きの囲いと呼吸・定位。",
    "快楽 8…C-0=来る（ドライ寄り）。C-1=帯を跨いだ積み上げ。",
    "満足 8…008 解除の手続き一貫。",
    "dlsite RJ190932（v2 フォルダ。表記差は配信面に従う）。",
    "【参照】analysis/ 同梱。"
  ]
}
