{
  "schemaVersion": 1,
  "workName": "だんだん下品になる催眠音声",
  "scores": {
    "trance": 8,
    "pleasure": 9,
    "satisfaction": 8
  },
  "orgasmSummary": "ドライシーン複数回（手を止めたカウント絶頂・前立腺感覚の言語追込）・ウェットシーン1回（手を許可したカウント射精）",
  "notes": [
    "評価は docs/レビュー三軸評価定義.md に準拠。採点は聴き込んだ本編音声のみ（注意事項・レクリエーション・本編・解除）。",
    "主軸は『こと玉融合と言霊体感化』『下品になるほど気持ちいい』の段階語彙条件づけ、手を止めたドライ絶頂の反復、最終はカウント射精と後催眠のオナ想起。",
    "レクリエーションは単体でも使える聴き分け訓練だが、本編の深度・言語追込の土台として本レビューに含めて評価。",
    "【自動補助根拠】derived_metrics.json: duration=8033.071s / surge_events_per_min=30.19。",
    "【自動補助根拠】keyword_counts: 気持ちいい=52, 暗示=10 / event_counts: countdown=2, trigger=26, release=12。"
  ]
}
