{
  "schemaVersion": 1,
  "workName": "ふたりがけ催眠ラブハピオーガズム編",
  "scores": {
    "trance": 8.0,
    "pleasure": 9.0,
    "satisfaction": 10.0
  },
  "orgasmSummary": "絶頂目安（本文総合評価と同期）: ドライ2回（幸福系）・ウェット0回",
  "notes": [
    "ふたりがけ催眠ラブハピオーガズム編 — アイアン・トライアングル（各軸 10.0 満点）",
    "第三軸: 満足度 = 興奮のあとの収束と安心感（星・三軸の前提は docs/レビュー三軸評価定義.md「評価の前提（完成度主軸）」）",
    "【評価方針】docs/レビュー三軸評価定義.md に沿う。",
    "【参照データ】本記事ディレクトリ内 `analysis/`（解析後フォルダから取り込み）。",
    "- `心拍活動.jpg` … Polar 聴取セッションの心拍グラフ（サイト用コピー: public/.../polar_h10_heart_rate_session.jpg）",
    "- 各トラック `*_waveform.csv` … 0.1 秒刻みの `timestamp_sec` / `amplitude_rms`（音声 RMS）/ `frequency_centroid_hz`",
    "- Whisper 由来の `.json` / `.txt` / `.tsv` / `.srt` / `.vtt` … 文字起こし・セグメント",
    "- `info.txt` … アフィリエイト用 HTML 断片",
    "【心拍（Polar）】`analysis/心拍活動.jpg` をレビュー直下 `polar_h10_heart_rate_session.jpg` にコピーし、`npm run sync:content-assets` で `public/.../polar_h10_heart_rate_session.jpg` に反映。",
    "本文は `### 聴取時の身体反応（心拍）` で画像のみ（波形の時刻・bpm 読み段落は載せない）。数値の整理は作品感想セクションに任せる。",
    "トランス度 8.0 … 往復で深さを積む。混乱型より褒め・安心が手順の芯。",
    "快楽度 9.0 … 褒めループと耳元、「好き」の反復で期待と報酬を言葉側に。",
    "満足度 10.0 … 褒め・掛け合い長尺が内容と一致。解除〜余韻で収束が立つ（おすすめ層前提）。",
    "絶頂目安（本文総合評価と同期）: ドライ2回（幸福系）・ウェット0回",
    "【グラフ用】四捨五入（整数）",
    "【自動補助根拠】derived_metrics.json: duration=6042.591s（約1:40:43、analysis/01〜07.srt 終端合算と一致）/ rms_mean=0.02375464 / silence_ratio=0.2645 / surge_events_per_min=30.176。",
    "【自動補助根拠】keyword_counts: 可愛い=7, ワン=0, 行け=0, 泣=0。event_counts: countdown=11, trigger=69, release=5。",
    "【自動補助根拠】sections.auto.json: 導入0.0-300.0 / 深化300.0-650.0 / 快楽650.0-5882.591 / 解除5882.591-6042.591。"
  ]
}
