{
  "schemaVersion": 1,
  "workName": "ふたりがけ催○カミングオーガズム編",
  "scores": {
    "trance": 9.0,
    "pleasure": 9.0,
    "satisfaction": 9.0
  },
  "orgasmSummary": "ドライ5回（カミング・多重ウェーブ・先端系）／ウェット0回",
  "notes": [
    "比較アンカー: saimin-shinri-test-dame-iwakareru（★3）〜unknown-hypno-daijobu-koe-ni-yudanete（★10）の間で、完成度・一貫性から★9相当。",
    "【評価方針】2017年作。ドライ単線・約70分前後。淫紋・亀頭責めまで含む構成で快楽の幅あり。",
    "トランス9…双子・呼吸／リズム同期で預けやすく体感寄り。瞑想型の深さより快感パートと連動。",
    "快楽9…快感の波・マルチプル・淫紋・亀頭と段階が増えるが主旨は「迎える」一線で統一。",
    "満足9…手拍子カウント解除で終わりが明確。グラフ本文はガイド調・キーフレーズ「」・着地は不安と音の打消しのセットで統一稿。",
    "【参照】解析同梱 v2 取込済。本編総尺は販売ページ表記を基本。",
    "【体裁】`### 作品解説と感想`・`## 作品像` を省略し、`## パート別解析` でパート別本文。末尾は `## 作品感想` の代わりに `## 総評：本作品の構造的結論`。`作品感想` 見出しが無いときはサイトが `rest` 末尾に「購入はこちら」を出す（評価横の体験版ボタンは従来どおり）。解析は短文因果・平易語・です／ます可（`docs/真催眠音声執筆ガイド.md` §3e）。解析素材は v2 と突き合わせ。"
  ]
}
