{
  "schemaVersion": 1,
  "workName": "タイムローター（RJ283004・リモコンローター屋外シチュ催眠音声）",
  "scores": {
    "trance": 8,
    "pleasure": 8,
    "satisfaction": 8
  },
  "orgasmSummary": "絶頂目安（本文総合評価と同期）: ドライシーン1回・ウェットシーン0回（満員電車・遅延許可と強度100%の帯）",
  "notes": [
    "評価は docs/レビュー三軸評価定義.md に準拠（鑑賞用・臨床非保証）。",
    "尺は各パートの波形終端秒を整数で合算した通しに準拠（公式表記は販売ページで約58分）。",
    "主軸は『古典的リラックス誘導』『リモコンローター装着の羞恥前提』『公園→繁華街→満員電車の段階的リスク』『カウント覚醒とメタ注意』の四層。",
    "音響面は販売ページどおりバイノーラル録音ではない（2016年原盤由来の旨）。定位は評価の主因にしない。",
    "比較アンカー: 下限は短い即効型、上限は屋外羞恥と遅延許可で吊るす電車帯が揃った構成として把握。",
    "【自動補助根拠】derived_metrics.json: duration=3540.575s / rms_mean=0.03693922 / silence_ratio=0.3368 / surge_events_per_min=30.097。",
    "【自動補助根拠】keyword_counts: 可愛い=4, ワン=0, 行け=1, 泣=0。event_counts: countdown=2, trigger=21, release=4。",
    "【自動補助根拠】sections.auto.json: 導入0.0-300.0 / 深化300.0-650.0 / 快楽650.0-3380.575 / 解除3380.575-3540.575。",
    "【体裁】2026-05 `docs/真催眠音声執筆ガイド.md` 完成系（解析結論・§11.0・§3g・§3h・§4b）で全面改稿。"
  ]
}
