{
  "schemaVersion": 1,
  "workName": "ドライオーガズム出来ない人の為の甘出し前立腺乳首オナニー術",
  "scores": { "trance": 8.0, "pleasure": 8.0, "satisfaction": 7.0 },
  "orgasmSummary": "ドライオーガズム（前立腺・乳首）多数。甘出し反復→性液空→ドライ。ウェットは甘出し設計に従い本文で区別",
  "notes": [
    "【再評価 2026-04】docs/レビュー三軸評価定義.md 現行。満足7＝戻し・帯配分（解除帯の相対的薄さ）であり、本編の長尺・作業的反復＝聴取負担の話は満点の減点主因に据えていない。",
    "【採点方針】三軸定義に従い、好み差を点数主因に据えない。",
    "【基準作比較】unknown-hypno-… 型＝往復・深化の長尺見本。本作＝一対一幼馴染+甘出し作業反復（別レーン）。",
    "トランス 8…誘導+本編に誘導尺の厚み。",
    "快楽 8…C-0=甘出し→ドライ。C-1=反復・カウント・段階づくり。",
    "満足 7…反復本編に比し解除帯は薄い帯配分。",
    "本編合計 1:28:48 表記（info）。実演前提の聴取が必要。",
    "【参照】analysis/ 同梱。"
  ]
}
