{
  "schemaVersion": 1,
  "workName": "ローテンション淫魔のうっかり魅了催眠",
  "scores": {
    "trance": 8,
    "pleasure": 9,
    "satisfaction": 8
  },
  "orgasmSummary": "ドライシーン複数回（頭内・好き宣言連動のドライ絶頂）／ウェットシーン1回（サキュバス姿・20カウント後の射精）",
  "notes": [
    "評価は docs/レビュー三軸評価定義.md に準拠（鑑賞用・臨床非保証）。",
    "尺は販売ページ表記で合計約1時間53分。レクリ→ドラマ→本編→解除。",
    "主軸は『客観→主観の視点移行』『魅了事故と未了状態』『ドライ絶頂の言語回収』『サキュバス解放後のウェット射精』。",
    "同一サークル saimin-yousei-surround-mugen-iki-mahou（RJ294932）と設計思想が近いF・A・S作品。",
    "【自動補助根拠】event_counts: trigger=45, release=20, 行け=10（derived_metrics は import 直後のファイル名ずれあり）。"
  ]
}
