{
  "schemaVersion": 1,
  "workName": "【催眠誘導】私と子作りしてください♡一夜限りの濃蜜孕ませ植物SEX「種孕」【連続∞メスイキ】",
  "scores": {
    "trance": 9.0,
    "pleasure": 10.0,
    "satisfaction": 9.0
  },
  "orgasmSummary": "絶頂目安（本文総合評価と同期）: ドライ5回・ウェット0回（受粉〜連続の山の概括／台本はメスイキ表現）",
  "notes": [
    "【催眠誘導】私と子作りしてください♡一夜限りの濃蜜孕ませ植物SEX「種孕」【連続∞メスイキ】 — アイアン・トライアングル（各軸 10.0 満点）",
    "第三軸: 満足度 = 興奮のあとの収束と安心感（本作は覚醒手順と余韻の落差を含む）",
    "【評価方針】docs/レビュー三軸評価定義.md に沿う。",
    "【参照データ】解析フォルダの文字起こし・トラック表。本編尺は 0.フルバージョン.srt 終端・derived_metrics.json の duration_sec（3099.387s≈51:39）に準拠。販売総尺51:42とは数秒差。",
    "長い導入で身体をほぐしてから蜜・受粉へ入り、連続絶頂の密度が高い。覚醒は手順として明示される一方、エンディングは販売文どおり余韻に冷たさも残す。",
    "トランス度 9.0 … 呼吸・ストレッチ・ゆりかごのイメージ、10 から 0 の逆カウント、蜜への沈下が段階的に続き、没入の厚みが大きい。",
    "快楽度 10.0 … 蜜・結合・花粉・種の反復で快感が途切れず、カウントと愛語が報酬を積み増す設計。",
    "満足度 9.0 … 1〜10 の覚醒で日常へ戻す道ははっきりし、余韻の落差はあっても手順として収束しやすい。",
    "絶頂目安（本文総合評価と同期）: ドライ5回・ウェット0回（受粉〜連続の山の概括／台本はメスイキ表現）",
    "【グラフ用】四捨五入（整数）",
    "【自動補助根拠】derived_metrics.json: duration=3099.387s / rms_mean=0.06427282 / silence_ratio=0.174 / surge_events_per_min=30.045。",
    "【自動補助根拠】keyword_counts: 可愛い=1, ワン=0, 行け=0, 泣=0。event_counts: countdown=9, trigger=9, release=2。",
    "【自動補助根拠】sections.auto.json: 導入0.0-300.0 / 深化300.0-650.0 / 快楽650.0-2939.387 / 解除2939.387-3099.387。"
  ]
}
