{
  "schemaVersion": 1,
  "workName": "メスガキサキュバスのおねえちゃんの彼氏寝取り催眠",
  "scores": {
    "trance": 8,
    "pleasure": 9,
    "satisfaction": 8
  },
  "orgasmSummary": "ドライシーン複数回（我慢ゲームの10→0・乳首弾き絶頂）／ウェットシーン1回（ごめんなさいカウント射精）",
  "notes": [
    "評価は docs/レビュー三軸評価定義.md に準拠（鑑賞用・臨床非保証）。",
    "尺は販売ページ表記で合計約2時間50分。注意→世界観→レクリ→ドラマ→本編→解除。",
    "主軸は『抵抗→快感変換の魔法』『半覚醒とお姉ちゃんにバレたら』『我慢ゲームのドライ連鎖』『ごめんなさい条件のウェット回収』。",
    "完成度比較: ★3アンカーより誘導・ゲーム設計・解除が明確に上。★10王道深化とは別レーン（NTR・メスガキ物語型）。",
    "【自動補助根拠】event_counts: trigger=55, release=29, countdown=16（derived_metrics.json）。"
  ]
}
