{
  "schemaVersion": 1,
  "workName": "両耳から脳をバグらせるダメダメ禁止暗示",
  "scores": {
    "trance": 9,
    "pleasure": 9,
    "satisfaction": 8
  },
  "orgasmSummary": "ドライ5回以上（禁止カウント連続ピーク）／ウェット1回（終盤射精誘導）",
  "notes": [
    "評価は docs/レビュー三軸評価定義.md に準拠（鑑賞用・臨床非保証）。",
    "本文グラフ内訳：トランス9（入り8・深さ10）、快楽9（快感設計9・絶頂シーン9）、満足8（着地8・余韻8）。",
    "否定暗示の概念説明から実演へ移行する構成で、理屈と快感誘導が接続している。",
    "解除で肯定暗示に切り替える回収が明確だが、刺激密度が高く相性はやや選ぶ。"
  ]
}
