{
  "schemaVersion": 1,
  "workName": "【魔改造推奨】極:無限絶頂カウントチクニー【両性向け 催眠音声】",
  "scores": {
    "trance": 10.0,
    "pleasure": 10.0,
    "satisfaction": 8.0
  },
  "orgasmSummary": "絶頂目安（本文総合評価と同期）: ドライ9回・ウェット無し（作品概要の絶頂シーン数に準拠／乳首ドライ寄り）",
  "notes": [
    "【魔改造推奨】極:無限絶頂カウントチクニー — アイアン・トライアングル（各軸 10.0 満点）",
    "第三軸: 満足度 = Homeostasis & Emotional Resolution（H_er）",
    "【評価方針】docs/レビュー三軸評価定義.md の T_ie / D_si / H_er に基づく定性評価。",
    "【体裁】2026-05 `docs/真催眠音声執筆ガイド.md` ルート B で本文を全面改稿。`### 作品解説と感想`・`## 作品像`・`## 作品感想` なし。",
    "`## パート別解析`（引用→解析→身体の反応）および `## 総評：本作品の構造的結論` の標準三柱で締め。解析素材は repo 内 `analysis/` と外向けフォルダ「極_無限絶頂カウントチクニー」を突き合わせ。",
    "【レイアウト】カミング標本（futarigake-saimin-coming-orgasm）グリッドに準拠 … title に【レビュー】・基本情報に主題・おすすめは改行段落・グラフ内訳はサブスコア＋小見出し二段・パート見出し三位・総評三柱。summary の「システム」は「手続き」に寄せた。2026-05-13 改稿: グラフ・おすすめの実行文からトラック番号裸参照を排除（§3b パート名）。tags 末尾にバイノーラル。フロントマター主要ブロック間の空行を標本に合わせた。",
    "【参照データ】解析フォルダ「極_無限絶頂カウントチクニー」（01〜10）。本編は 06 ループのあと",
    "07 脱出・08〜09 後催眠・10 覚醒があり、興奮側（04〜06）のあと手続き的に収束する設計。",
    "トランス度 9.7 … 双子の左右定位と「混ざる声」で自己参照追跡が緩む／メトロノーム・拮抗・",
    "長い間による曖昧さ・ペーシングが強い。02〜03 の「深さの頂」が軸。",
    "快楽度 10.0 … 期待と報酬のラグ（焦らし・禁止・カウント）、定位、「カリカリ」等の",
    "アンカーリングが一貫。報酬系のピーク設計として満点帯。",
    "満足度 7.9 … 06 単体では「無限」テーマで未完了感が強いが、本編を最後まで聴く前提では",
    "07〜10 が脱出・後催眠・覚醒で手続き的に締め、余韻の整理と身体への戻りを補う。",
    "（06 のループだけで止めると満足度は下がりうる。安眠版・全年齢版は別評価の対象。）",
    "絶頂目安（本文総合評価と同期）: ドライ9回・ウェット無し（作品概要の絶頂シーン数に準拠／乳首ドライ寄り）",
    "【グラフ用】raw を四捨五入（整数）: 9.7→10, 10.0→10, 7.9→8",
    "【自動補助根拠】derived_metrics.json: duration=3153.194s / rms_mean=0.00599694 / silence_ratio=0.4706 / surge_events_per_min=31.111。",
    "【自動補助根拠】keyword_counts: 可愛い=2, ワン=0, 行け=2, 泣=0。event_counts: countdown=7, trigger=10, release=7。",
    "【自動補助根拠】sections.auto.json: 導入0.0-300.0 / 深化300.0-650.0 / 快楽650.0-2993.194 / 解除2993.194-3153.194。"
  ]
}
