{
  "schemaVersion": 1,
  "workName": "【催眠音声】ブレインウォッシャー",
  "scores": { "trance": 8.0, "pleasure": 8.0, "satisfaction": 7.0 },
  "orgasmSummary": "ドライ 2回前後（儀式の圧と左右の圧着）、ウェットは作品設計上そこまで前面でない想定",
  "notes": [
    "【採点方針】三軸定義に従い、好み差を点数主因に据えない。",
    "【基準作比較】unknown-hypno-… 型。本作＝教団比喩+多声+脳イキ寄り聴感（別レーン）。",
    "トランス 8…左右囲い。教団皮膜に乗れない層は9〜10手前。",
    "快楽 8…C-0=脳イキ寄り+耳。C-1=多幸感反復。中盤以降同型帯。",
    "満足 7…帰属台詞が戻し帯に二重層。本編比し解除短尺。",
    "合わない人: 教団比喩が苦手な層。",
    "【参照】analysis/ 同梱。"
  ]
}
