{
  "schemaVersion": 1,
  "workName": "スキスキ刷り込み♡ちゅーどくおなにー催眠",
  "scores": {
    "trance": 8.0,
    "pleasure": 8.0,
    "satisfaction": 8.0
  },
  "orgasmSummary": "絶頂目安（本文総合評価と同期）: ドライ0回・ウェット1回（オナニー誘導本編のクライマックス1区間の概括）",
  "notes": [
    "スキスキ刷り込み♡ちゅーどくおなにー催眠 — アイアン・トライアングル（各軸 10.0 満点）",
    "第三軸: 満足度 = Homeostasis & Emotional Resolution（H_er）",
    "【評価方針】docs/レビュー三軸評価定義.md の T_ie / D_si / H_er。",
    "【参照データ】解析フォルダの Whisper セグメント（5 トラック・本編合計約 79 分）。",
    "導入は短く、本編はヘミシンク〜身体脱力、深化・逆カウント、長尺のオナニー誘導と解除まで一気通貫。",
    "トランス度 8.0 … 呼吸のペーシング、身体部位の順番による脱力、逆カウントと「声だけ」の切り替えで",
    "没入を積む設計。尺の多くが誘導と深化に割かれているが、長尺・反復の受け取り方には個人差。",
    "快楽度 8.0 … 「好き」「名前」「快感」を結びつける反復と、もどかしさの設計が厚い。R18 の指示系として",
    "刺激の出方は明確だが、語りの好みで伸びしろを残す。",
    "満足度 8.0 … 10 までの段階的覚醒と、暗示を「奥に残す」扱いの言語化、締めの声かけまで揃う。",
    "長尺のため主観の疲労感には個人差。",
    "絶頂目安（本文総合評価と同期）: ドライ0回・ウェット1回（オナニー誘導本編のクライマックス1区間の概括）",
    "【グラフ用】四捨五入（整数）",
    "【自動補助根拠】derived_metrics.json: duration=4743.083s / rms_mean=0.01095471 / silence_ratio=0.5307 / surge_events_per_min=30.132。",
    "【自動補助根拠】keyword_counts: 可愛い=3, ワン=0, 行け=1, 泣=1。event_counts: countdown=1, trigger=15, release=7。",
    "【自動補助根拠】sections.auto.json: 導入0.0-300.0 / 深化300.0-650.0 / 快楽650.0-4583.083 / 解除4583.083-4743.083。"
  ]
}
